{
  "schema_version": 1,
  "source": "SYNTHETIC_TEST",
  "screen_state": "PLAYER_DETAIL_BATTER",
  "frame_size": [1000, 1000],
  "active_panel": [0.4, 0.1, 0.2, 0.8],
  "observations": [
    {"schema_version": 1, "text": "홍길동'25", "confidence": 0.99, "bbox": [0.43, 0.72, 0.12, 0.04], "source": "SYNTHETIC_TEST", "field": null},
    {"schema_version": 1, "text": "시그니처", "confidence": 0.99, "bbox": [0.43, 0.66, 0.10, 0.03], "source": "SYNTHETIC_TEST", "field": null},
    {"schema_version": 1, "text": "★★★★★", "confidence": 0.99, "bbox": [0.43, 0.61, 0.10, 0.03], "source": "SYNTHETIC_TEST", "field": null},
    {"schema_version": 1, "text": "+8", "confidence": 0.99, "bbox": [0.43, 0.56, 0.05, 0.03], "source": "SYNTHETIC_TEST", "field": null},
    {"schema_version": 1, "text": "OVR", "confidence": 0.99, "bbox": [0.43, 0.50, 0.08, 0.03], "source": "SYNTHETIC_TEST", "field": null},
    {"schema_version": 1, "text": "112.5", "confidence": 0.99, "bbox": [0.43, 0.44, 0.08, 0.04], "source": "SYNTHETIC_TEST", "field": null}
  ]
}
